{
  "id": "11111111-1111-1111-1111-111111111111",
  "run_id": "22222222-2222-2222-2222-222222222222",
  "status": "PASSED",
  "checks": [
    {
      "name": "cargo_clippy",
      "passed": true,
      "output": "clippy finished with 0 warnings",
      "duration_ms": 1240
    },
    {
      "name": "deny_path_unit_tests",
      "passed": true,
      "output": "14 passed; 0 failed",
      "duration_ms": 320
    }
  ],
  "created_at": "2026-10-02T16:05:00Z"
}
